{
  "schema_version": "1.0.0",
  "problem_id": "sum-two-numbers",
  "version": 2,
  "pseudocode_rubric": {
    "pass_score": 70,
    "criteria": [
      {"id": "seed_prefix", "description": "빈 구간의 누적합 0을 한 번 등록한다.", "weight": 20},
      {"id": "track_prefix", "description": "수열을 순회하며 누적합을 갱신한다.", "weight": 20},
      {"id": "count_targets", "description": "현재 누적합-K의 이전 등장 횟수를 정답에 더한다.", "weight": 40},
      {"id": "update_frequency", "description": "현재 누적합의 등장 횟수를 갱신하고 64비트 정답을 출력한다.", "weight": 20}
    ]
  },
  "reference_solutions": {
    "python": "from collections import defaultdict\n\nn, target = map(int, input().split())\nvalues = list(map(int, input().split()))\nfrequency = defaultdict(int)\nfrequency[0] = 1\nprefix = answer = 0\nfor value in values:\n    prefix += value\n    answer += frequency[prefix - target]\n    frequency[prefix] += 1\nprint(answer)\n",
    "cpp": "#include <iostream>\n#include <unordered_map>\nusing namespace std;\nint main() { int n; long long target; cin >> n >> target; unordered_map<long long, long long> frequency; frequency[0] = 1; long long prefix = 0, answer = 0; while (n--) { long long value; cin >> value; prefix += value; auto it = frequency.find(prefix - target); if (it != frequency.end()) answer += it->second; ++frequency[prefix]; } cout << answer << '\\n'; }\n"
  },
  "hidden_tests": [
    {"name": "negative_cancellation", "input": "5 0\n1 -1 1 -1 1\n", "expected_output": "6\n"},
    {"name": "all_negative", "input": "3 -3\n-1 -1 -1\n", "expected_output": "1\n"},
    {"name": "repeated_prefixes", "input": "6 5\n5 -5 5 -5 5 -5\n", "expected_output": "6\n"}
  ]
}
