{
  "schema_version": "1.0.0",
  "problem_id": "rotate-array",
  "version": 2,
  "pseudocode_rubric": {
    "pass_score": 70,
    "criteria": [
      {"id": "index_values", "description": "각 값이 두 순열에서 등장하는 위치를 기록한다.", "weight": 25},
      {"id": "calculate_shift", "description": "B 위치-A 위치를 N으로 보정해 오른쪽 회전량을 구한다.", "weight": 35},
      {"id": "count_shifts", "description": "각 회전량의 일치 빈도를 센다.", "weight": 25},
      {"id": "tie_break", "description": "최대 빈도 중 가장 작은 회전량을 출력한다.", "weight": 15}
    ]
  },
  "reference_solutions": {
    "python": "n = int(input())\nfirst = list(map(int, input().split()))\nsecond = list(map(int, input().split()))\nposition = [0] * (n + 1)\nfor index, value in enumerate(second):\n    position[value] = index\nfrequency = [0] * n\nfor index, value in enumerate(first):\n    frequency[(position[value] - index) % n] += 1\nbest_count = max(frequency)\nbest_shift = frequency.index(best_count)\nprint(best_count, best_shift)\n",
    "cpp": "#include <algorithm>\n#include <iostream>\n#include <vector>\nusing namespace std;\nint main() { int n; cin >> n; vector<int> first(n), position(n + 1), frequency(n); for (int &value : first) cin >> value; for (int i = 0, value; i < n; ++i) { cin >> value; position[value] = i; } for (int i = 0; i < n; ++i) ++frequency[(position[first[i]] - i + n) % n]; int best = *max_element(frequency.begin(), frequency.end()); int shift = find(frequency.begin(), frequency.end(), best) - frequency.begin(); cout << best << ' ' << shift << '\\n'; }\n"
  },
  "hidden_tests": [
    {"name": "single_value", "input": "1\n1\n1\n", "expected_output": "1 0\n"},
    {"name": "full_rotation", "input": "3\n1 2 3\n2 3 1\n", "expected_output": "3 2\n"},
    {"name": "tie_smallest_shift", "input": "4\n1 2 3 4\n2 1 4 3\n", "expected_output": "2 1\n"}
  ]
}
